{
  "goal": "Find a nearby checkout state we forgot to test",
  "stateSummary": "Cart with SAVE20 applied; every branch from here has been visited",
  "remainingActions": 2,
  "safeCandidates": [
    {
      "proposalId": "p1",
      "label": "Return to products",
      "risk": "LOW",
      "novelty": 0.05,
      "reversibleLikelihood": 0.9,
      "selectorStability": 0.9,
      "visitCount": 3
    },
    {
      "proposalId": "p2",
      "label": "Open cart menu",
      "risk": "MEDIUM",
      "novelty": 0.1,
      "reversibleLikelihood": 0.5,
      "selectorStability": 0.4,
      "visitCount": 2
    }
  ]
}
